{
  "type": "partial",
  "version": "1",
  "intent": {
    "certificates": [
      {
        "type": "voteDelegation",
        "drep": "drep1y2wfmxsjt7786qc663mts7qh5m9nzn27qjzrpuglaq6wsgqws500e"
      }
    ],
    "validUntil": "2026-08-22T19:40:00Z"
  },
  "message": "Delegate your voting power to the Community DRep."
}
